{
  "$schema": "../../../../../apps/project-tracker/docs/metrics/schemas/task-tracking.schema.json",
  "actual_duration_minutes": 15,
  "artifacts": {
    "created": [],
    "expected": [],
    "missing": []
  },
  "completed_at": "2026-04-13T00:42:36.754Z",
  "dependencies_meta": {
    "verified_at": "2026-04-29T21:54:51.692Z"
  },
  "notes": "Sprint 0 task completed.",
  "started_at": "2026-04-13T00:27:36.754Z",
  "task_id": "ENG-OPS-001",
  "validations": [
    {
      "command": "pnpm test",
      "executed_at": "2025-12-14T12:00:00Z",
      "exit_code": 0,
      "name": "environment-setup",
      "passed": true
    }
  ]
}
