{
  "$schema": "../../../../../apps/project-tracker/docs/metrics/schemas/task-tracking.schema.json",
  "actual_duration_minutes": 45,
  "artifacts": {
    "created": [
      "apps/web/src/app/(public)/blog/[slug]/page.tsx"
    ],
    "expected": [
      "apps/web/src/app/(public)/blog/[slug]/page.tsx"
    ],
    "missing": []
  },
  "blockers": [],
  "completed_at": "2025-12-31T08:00:00Z",
  "dependencies_meta": {
    "verified_at": "2026-04-29T21:54:51.933Z"
  },
  "kpis": {
    "markdown_rendering": {
      "actual": true,
      "met": true,
      "target": true
    }
  },
  "started_at": "2025-12-31T07:15:00Z",
  "status_history": [
    {
      "at": "2025-12-31T08:00:00Z",
      "note": "Blog post page completed",
      "status": "DONE"
    }
  ],
  "task_id": "PG-010",
  "validations": [
    {
      "command": "pnpm --filter web build",
      "executed_at": "2025-12-31T07:55:00Z",
      "exit_code": 0,
      "name": "Web Build",
      "passed": true,
      "required": true,
      "timestamp": "2025-12-31T08:00:00Z",
      "type": "auto"
    }
  ]
}
