{
  "$schema": "../../../../../apps/project-tracker/docs/metrics/schemas/task-tracking.schema.json",
  "actual_duration_minutes": 45,
  "artifacts": {
    "created": [
      {
        "created_at": "2025-12-31T03:36:53Z",
        "path": "apps/ai-worker/src/chains/scoring.chain.ts",
        "sha256": "d3e164c787d1789f9f9fb7a7687b32b0ab30b33bd560ad1df9235990c9435af1"
      }
    ],
    "expected": [],
    "missing": []
  },
  "blockers": [],
  "completed_at": "2025-12-31T03:36:53Z",
  "dependencies_meta": {
    "verified_at": "2026-04-29T21:54:51.745Z"
  },
  "kpis": {
    "pipeline_extensible": {
      "actual": true,
      "met": true,
      "target": true
    }
  },
  "started_at": "2025-12-31T02:50:00Z",
  "status_history": [
    {
      "at": "2025-12-31T03:36:53Z",
      "note": "Pipeline design completed",
      "status": "DONE"
    }
  ],
  "task_id": "IFC-020",
  "validations": [
    {
      "command": "pnpm --filter ai-worker build",
      "executed_at": "2025-12-31T22:25:00Z",
      "exit_code": 0,
      "name": "Build",
      "passed": true,
      "required": true,
      "timestamp": "2025-12-31T03:36:53Z",
      "type": "auto"
    }
  ]
}
