{
  "$schema": "../../../../../apps/project-tracker/docs/metrics/schemas/task-tracking.schema.json",
  "actual_duration_minutes": 15,
  "artifacts": {
    "expected": [],
    "missing": []
  },
  "completed_at": "2026-03-08T21:59:04.545Z",
  "dependencies_meta": {
    "verified_at": "2026-04-29T21:54:51.953Z"
  },
  "notes": "Evidence stub. Task marked Completed in Sprint_plan.csv. Full evidence may be recorded in sprint attestations or audit reports.",
  "started_at": "2026-03-08T21:44:04.545Z",
  "task_id": "IFC-133",
  "validations": [
    {
      "command": "# Task marked Completed in Sprint_plan.csv",
      "executed_at": "2026-03-08T00:00:00Z",
      "exit_code": 0,
      "name": "completion-evidence",
      "passed": true
    }
  ]
}
