{
  "$schema": "../../../../../apps/project-tracker/docs/metrics/schemas/task-tracking.schema.json",
  "artifacts": {
    "created": [
      "apps/web/src/app/contacts/(list)/contact-settings/page.tsx",
      "apps/web/src/app/contacts/(list)/contact-settings/ContactSettingsContent.tsx",
      "apps/api/src/modules/contact/contact-settings.router.ts",
      "apps/api/src/modules/contact/contact-automation.ts",
      "packages/validators/src/contact-settings.ts",
      ".specify/sprints/sprint-17/specifications/PG-182-spec.md",
      ".specify/sprints/sprint-17/planning/PG-182-plan.md",
      ".specify/sprints/sprint-17/attestations/PG-182/context_ack.json",
      ".specify/sprints/sprint-17/attestations/PG-182/attestation.json"
    ],
    "expected": [
      "apps/web/src/app/contacts/(list)/contact-settings/page.tsx",
      "apps/web/src/app/contacts/(list)/contact-settings/ContactSettingsContent.tsx",
      "apps/api/src/modules/contact/contact-settings.router.ts",
      "apps/api/src/modules/contact/contact-automation.ts",
      "packages/validators/src/contact-settings.ts",
      ".specify/sprints/sprint-17/specifications/PG-182-spec.md",
      ".specify/sprints/sprint-17/planning/PG-182-plan.md",
      ".specify/sprints/sprint-17/attestations/PG-182/context_ack.json",
      ".specify/sprints/sprint-17/attestations/PG-182/attestation.json"
    ],
    "missing": []
  },
  "blockers": [],
  "completed_at": "2026-04-15T09:00:00Z",
  "dependencies_meta": {
    "verified_at": "2026-04-29T21:54:51.842Z"
  },
  "execution": {
    "executor": "orchestrator",
    "last_error": null,
    "log_path": null,
    "retry_count": 0
  },
  "kpis": {
    "all_form_fields_render": {
      "actual": true,
      "met": true,
      "target": true
    },
    "lighthouse_score": {
      "actual": 90,
      "met": true,
      "target": 90,
      "unit": "score"
    },
    "sidebar_nav_works": {
      "actual": true,
      "met": true,
      "target": true
    }
  },
  "notes": "Contact settings page at /contacts/contact-settings with duplicate detection, required fields, tags config, and automation toggles. Uses in-module settings sidebar pattern (ContactSettingsSidebarNav). 7 files modified including contact-automation.ts, contact-settings.router.ts, validators. Module-settings playbook at docs/planning/module-settings-playbook.md codifies the hardening checklist for PG-184+.",
  "phase": "",
  "started_at": "2026-04-15T08:00:00Z",
  "status_history": [
    {
      "at": "2026-03-08T18:00:00Z",
      "note": "Task created — Contact settings page with duplicate detection, required fields, tags config; uses in-module settings sidebar pattern",
      "status": "Backlog"
    },
    {
      "at": "2026-04-15T09:00:00Z",
      "note": "PG-182 hardening complete. All 4 validations pass. Automation toggles wired: normalizePhoneNumbers, autoCapitalizeNames, preventDeleteWithOpenDeals, restrictTagCreationToAdmins + ContactRequiredField enforcement.",
      "status": "Completed"
    }
  ],
  "stream": null,
  "task_id": "PG-182",
  "validations": [
    {
      "command": "pnpm --filter @intelliflow/validators typecheck && pnpm --filter @intelliflow/api typecheck && pnpm --filter @intelliflow/web typecheck",
      "executed_at": "2026-04-15T08:45:00Z",
      "exit_code": 0,
      "name": "TypeScript",
      "passed": true
    },
    {
      "command": "pnpm --filter @intelliflow/validators test --run && pnpm --filter @intelliflow/api test --run && pnpm --filter @intelliflow/web test --run contact-settings",
      "executed_at": "2026-04-15T08:50:00Z",
      "exit_code": 0,
      "name": "Tests",
      "passed": true
    },
    {
      "command": "pnpm --filter @intelliflow/api lint && pnpm --filter @intelliflow/web lint",
      "executed_at": "2026-04-15T08:52:00Z",
      "exit_code": 0,
      "name": "Lint",
      "passed": true
    },
    {
      "command": "pnpm --filter @intelliflow/web build",
      "executed_at": "2026-04-15T09:00:00Z",
      "exit_code": 0,
      "name": "Build",
      "passed": true
    }
  ]
}
