{
  "$schema": "../../../../../apps/project-tracker/docs/metrics/schemas/task-tracking.schema.json",
  "artifacts": {
    "created": [
      "packages/adapters/src/repositories/PrismaAccountRepository.ts",
      "apps/project-tracker/docs/metrics/_global/phase-validations/PHASE-039-validation.md"
    ],
    "expected": [
      "packages/adapters/src/repositories/PrismaAccountRepository.ts",
      "apps/project-tracker/docs/metrics/_global/phase-validations/PHASE-039-validation.md"
    ],
    "missing": []
  },
  "blockers": [],
  "completed_at": "2025-12-22T18:30:00Z",
  "dependencies_meta": {
    "notes": "IFC-002 Domain Model Design completed - bounded contexts defined",
    "verified_at": "2026-04-29T21:54:51.720Z"
  },
  "execution": {
    "completed_at": "2025-12-22T18:30:00Z",
    "duration_minutes": 60,
    "execution_log": "logs/sprint-2/IFC-103.log",
    "executor": "claude-opus-4.5-matop",
    "run_id": "20251222-173000-ifc103",
    "started_at": "2025-12-22T17:30:00Z"
  },
  "implements": {
    "description": "Implements Domain Architecture Foundation - Account aggregate",
    "flows": [
      "FLOW-039"
    ],
    "verified_at": "2025-12-22T18:30:00Z"
  },
  "kpis": {
    "design_approved": {
      "actual": true,
      "met": true,
      "target": true,
      "unit": "boolean"
    },
    "repository_api_stable": {
      "actual": true,
      "met": true,
      "target": true,
      "unit": "boolean"
    },
    "unit_test_coverage": {
      "actual": "93%",
      "met": true,
      "target": ">=90%",
      "unit": "percentage"
    }
  },
  "notes": "Account aggregate implemented with value objects (AccountId, CompanyName, Industry, Address). PrismaAccountRepository provides CRUD operations with contact relationship handling. Repository pattern follows hexagonal architecture - domain has no infrastructure dependencies.",
  "started_at": "2025-12-22T17:30:00Z",
  "status_history": [
    {
      "at": "2025-12-14T00:00:00Z",
      "status": "PLANNED"
    },
    {
      "at": "2025-12-22T17:30:00Z",
      "status": "IN_PROGRESS"
    },
    {
      "at": "2025-12-22T18:30:00Z",
      "status": "DONE"
    }
  ],
  "stoa_verdicts": {
    "consensus": "PASS",
    "domain_verdict": "PASS",
    "lead": "Domain",
    "quality_verdict": "PASS",
    "supporting": [
      "Quality"
    ]
  },
  "task_id": "IFC-103",
  "validations": [
    {
      "command": "test -f packages/adapters/src/repositories/PrismaAccountRepository.ts",
      "executed_at": "2025-12-22T18:30:00Z",
      "exit_code": 0,
      "name": "repository_exists",
      "passed": true,
      "timestamp": "2025-12-22T18:30:00Z"
    },
    {
      "command": "pnpm --filter @intelliflow/adapters typecheck",
      "duration_ms": 12000,
      "executed_at": "2025-12-22T18:30:00Z",
      "exit_code": 0,
      "name": "typecheck",
      "passed": true,
      "timestamp": "2025-12-22T18:30:00Z"
    },
    {
      "command": "pnpm test --filter @intelliflow/adapters",
      "executed_at": "2025-12-22T18:30:00Z",
      "exit_code": 0,
      "name": "test_coverage",
      "output_summary": "Account repository tests passing, coverage >90%",
      "passed": true,
      "timestamp": "2025-12-22T18:30:00Z"
    }
  ],
  "waivers": []
}
