{
  "$schema": "../../../../../apps/project-tracker/docs/metrics/schemas/task-tracking.schema.json",
  "actual_duration_minutes": 15,
  "artifacts": {
    "created": [
      "apps/api/src/modules/help-article/help-article.router.ts"
    ],
    "expected": [
      "apps/api/src/modules/help-article/help-article.router.ts"
    ],
    "missing": []
  },
  "blockers": [],
  "completed_at": "2026-03-19T00:28:57.314Z",
  "dependencies_meta": {
    "verified_at": "2026-04-29T21:54:51.841Z"
  },
  "execution": {
    "last_error": null,
    "retry_count": 0
  },
  "kpis": {
    "coverage": {
      "actual": "Statements 91.45%, Branches 80.48%, Functions 100%, Lines 95.45% (59 router tests + 17 widget tests)",
      "met": true,
      "target": "Statements >=90%, Branches >=80%, Functions >=90%, Lines >=90%"
    }
  },
  "notes": "helpArticle.submitFeedback mutation (articleId, value: helpful|not_helpful, optional comment). Stores in ArticleFeedback table. Wires FeedbackWidget onFeedback callback to tRPC.",
  "phase": "",
  "started_at": "2026-03-18T00:00:00Z",
  "status_history": [
    {
      "at": "2026-03-08T18:00:00Z",
      "note": "Task created — Article feedback persistence + analytics aggregation",
      "status": "Backlog"
    },
    {
      "at": "2026-03-18T00:00:00Z",
      "note": "Spec session started — 4 agents (Backend-Architect, Data-Engineer, Domain-Expert, Test-Engineer)",
      "status": "In Progress"
    },
    {
      "at": "2026-03-18T00:00:00Z",
      "note": "Spec session complete — 4/4 consensus, spec at .specify/sprints/sprint-17/specifications/IFC-303-spec.md",
      "status": "In Progress"
    },
    {
      "at": "2026-03-18T00:00:00Z",
      "note": "Plan session started — TDD decomposition",
      "status": "Planned"
    },
    {
      "at": "2026-03-18T00:00:00Z",
      "note": "Plan session complete — reviewer approved after 3 fixes, plan at .specify/sprints/sprint-17/planning/IFC-303-plan.md",
      "status": "Planned"
    },
    {
      "at": "2026-03-19T00:20:00Z",
      "note": "Exec started — run-20260319T002005Z-91b88ab9",
      "status": "In Progress"
    },
    {
      "at": "2026-03-19T00:30:00Z",
      "note": "Exec complete — submitFeedback + getFeedbackStats added, FeedbackWidget wired, 76 tests pass, coverage >=90%",
      "status": "Completed"
    }
  ],
  "stream": null,
  "task_id": "IFC-303",
  "validations": [
    {
      "command": "pnpm --filter @intelliflow/api typecheck",
      "duration_ms": 8000,
      "executed_at": "2026-03-19T00:26:00Z",
      "exit_code": 0,
      "name": "TypeScript",
      "passed": true
    },
    {
      "command": "npx vitest run apps/api/src/modules/help-article/__tests__/help-article.router.test.ts",
      "duration_ms": 884,
      "executed_at": "2026-03-19T00:24:00Z",
      "exit_code": 0,
      "name": "Tests",
      "passed": true
    },
    {
      "command": "npx eslint apps/api/src/modules/help-article/help-article.router.ts apps/web/src/components/support/feedback-widget.tsx",
      "duration_ms": 5000,
      "executed_at": "2026-03-19T00:26:30Z",
      "exit_code": 0,
      "name": "Lint",
      "passed": true
    },
    {
      "command": "pnpm build",
      "duration_ms": 15000,
      "executed_at": "2026-03-19T00:27:00Z",
      "exit_code": 0,
      "name": "Build",
      "passed": true
    }
  ]
}
